results/rocblas.csv

# torch 2.10.0+rocm7.0 hip 7.0.51831 triton 3.6.0
impl,M,N,K,tag,ms,tflops,tbs,ai
rocBLAS,512,512,512,square,0.01776,15.11,0.089,170.7
rocBLAS,1024,1024,1024,square,0.04544,47.26,0.138,341.3
rocBLAS,2048,2048,2048,square,0.19664,87.37,0.128,682.7
rocBLAS,4096,4096,4096,square,1.35938,101.1,0.074,1365.3
rocBLAS,8192,8192,8192,square,10.34318,106.3,0.039,2730.7
rocBLAS,2048,4096,4096,prefill,0.65441,105.01,0.103,1024.0
rocBLAS,2048,11008,4096,prefill,1.6613,111.17,0.092,1214.7
rocBLAS,2048,4096,11008,prefill,1.64722,112.12,0.092,1214.7
rocBLAS,1,4096,4096,decode,0.04848,0.69,0.692,1.0
rocBLAS,4,4096,4096,decode,0.04928,2.72,0.682,4.0
rocBLAS,16,4096,4096,decode,0.05024,10.69,0.673,15.9
rocBLAS,1,11008,4096,decode,0.08,1.13,1.128,1.0
rocBLAS,1024,3840,1280,esm,0.13184,76.35,0.154,495.5
rocBLAS,1024,1280,1280,esm,0.05488,61.14,0.155,393.8
rocBLAS,1024,5120,1280,esm,0.1608,83.47,0.163,512.0
rocBLAS,1024,1280,5120,esm,0.15248,88.02,0.172,512.0
rocBLAS,1000,1000,1000,odd,0.05104,39.18,0.118,333.3
rocBLAS,3000,2000,1500,odd,0.23528,76.5,0.115,666.7

LOG.md

## Day 3

square      512x   512x   512  rocBLAS   15.11   triton_v0    9.75 (  65%)   triton_v1    6.93 (  46%)
square     1024x  1024x  1024  rocBLAS   47.26   triton_v0   17.52 (  37%)   triton_v1   32.90 (  70%)
square     2048x  2048x  2048  rocBLAS   87.37   triton_v0   20.81 (  24%)   triton_v1   72.45 (  83%)
square     4096x  4096x  4096  rocBLAS  101.10   triton_v0   19.18 (  19%)   triton_v1   90.43 (  89%)
square     8192x  8192x  8192  rocBLAS  106.30   triton_v0   19.50 (  18%)   triton_v1   76.28 (  72%)
prefill    2048x  4096x  4096  rocBLAS  105.01   triton_v0   19.49 (  19%)   triton_v1   88.45 (  84%)
prefill    2048x 11008x  4096  rocBLAS  111.17   triton_v0   14.97 (  13%)   triton_v1   93.15 (  84%)
prefill    2048x  4096x 11008  rocBLAS  112.12   triton_v0   18.18 (  16%)   triton_v1   92.11 (  82%)
decode        1x  4096x  4096  rocBLAS    0.69   triton_v0    0.29 (  42%)   triton_v1    0.18 (  26%)
decode        4x  4096x  4096  rocBLAS    2.72   triton_v0    1.16 (  43%)   triton_v1    0.70 (  26%)
decode       16x  4096x  4096  rocBLAS   10.69   triton_v0    4.54 (  42%)   triton_v1    2.79 (  26%)
decode        1x 11008x  4096  rocBLAS    1.13   triton_v0    0.57 (  50%)   triton_v1    0.45 (  40%)
esm        1024x  3840x  1280  rocBLAS   76.35   triton_v0   20.83 (  27%)   triton_v1   62.73 (  82%)
esm        1024x  1280x  1280  rocBLAS   61.14   triton_v0   19.42 (  32%)   triton_v1   42.11 (  69%)
esm        1024x  5120x  1280  rocBLAS   83.47   triton_v0   21.03 (  25%)   triton_v1   76.26 (  91%)
esm        1024x  1280x  5120  rocBLAS   88.02   triton_v0   20.55 (  23%)   triton_v1   51.24 (  58%)
odd        1000x  1000x  1000  rocBLAS   39.18   triton_v0   13.97 (  36%)   triton_v1   18.38 (  47%)
odd        3000x  2000x  1500  rocBLAS   76.50   triton_v0   18.46 (  24%)   triton_v1   63.77 (  83%)

## Day 4

data from bench.compare results/triton_v1.csv results/triton_v3.csv
square      512x   512x   512  rocBLAS   15.11   triton_v1    6.93 (  46%)   triton_v3   13.64 (  90%)
square     1024x  1024x  1024  rocBLAS   47.26   triton_v1   32.90 (  70%)   triton_v3   45.19 (  96%)
square     2048x  2048x  2048  rocBLAS   87.37   triton_v1   72.45 (  83%)   triton_v3   75.99 (  87%)
square     4096x  4096x  4096  rocBLAS  101.10   triton_v1   90.43 (  89%)   triton_v3   95.15 (  94%)
square     8192x  8192x  8192  rocBLAS  106.30   triton_v1   76.28 (  72%)   triton_v3  102.29 (  96%)
prefill    2048x  4096x  4096  rocBLAS  105.01   triton_v1   88.45 (  84%)   triton_v3   90.44 (  86%)
prefill    2048x 11008x  4096  rocBLAS  111.17   triton_v1   93.15 (  84%)   triton_v3   94.40 (  85%)
prefill    2048x  4096x 11008  rocBLAS  112.12   triton_v1   92.11 (  82%)   triton_v3   93.33 (  83%)
decode        1x  4096x  4096  rocBLAS    0.69   triton_v1    0.18 (  26%)   triton_v3    0.44 (  64%)
decode        4x  4096x  4096  rocBLAS    2.72   triton_v1    0.70 (  26%)   triton_v3    1.74 (  64%)
decode       16x  4096x  4096  rocBLAS   10.69   triton_v1    2.79 (  26%)   triton_v3    6.95 (  65%)
decode        1x 11008x  4096  rocBLAS    1.13   triton_v1    0.45 (  40%)   triton_v3    0.90 (  80%)
esm        1024x  3840x  1280  rocBLAS   76.35   triton_v1   62.73 (  82%)   triton_v3   68.31 (  89%)
esm        1024x  1280x  1280  rocBLAS   61.14   triton_v1   42.11 (  69%)   triton_v3   58.91 (  96%)
esm        1024x  5120x  1280  rocBLAS   83.47   triton_v1   76.26 (  91%)   triton_v3   80.35 (  96%)
esm        1024x  1280x  5120  rocBLAS   88.02   triton_v1   51.24 (  58%)   triton_v3   74.63 (  85%)
odd        1000x  1000x  1000  rocBLAS   39.18   triton_v1   18.38 (  47%)   triton_v3   26.54 (  68%)
odd        3000x  2000x  1500  rocBLAS   76.50   triton_v1   63.77 (  83%)   triton_v3   65.37 (  85%)

### test results for 0b:

square      512x   512x   512  rocBLAS   15.11   triton_v3   13.64 (  90%)   triton_v4   14.10 (  93%)
square     1024x  1024x  1024  rocBLAS   47.26   triton_v3   45.19 (  96%)   triton_v4   44.44 (  94%)
square     2048x  2048x  2048  rocBLAS   87.37   triton_v3   75.99 (  87%)   triton_v4   76.80 (  88%)
square     4096x  4096x  4096  rocBLAS  101.10   triton_v3   95.15 (  94%)   triton_v4   97.98 (  97%)
square     8192x  8192x  8192  rocBLAS  106.30   triton_v3  102.29 (  96%)   triton_v4  105.26 (  99%)
prefill    2048x  4096x  4096  rocBLAS  105.01   triton_v3   90.44 (  86%)   triton_v4   92.09 (  88%)
prefill    2048x 11008x  4096  rocBLAS  111.17   triton_v3   94.40 (  85%)   triton_v4   96.25 (  87%)
prefill    2048x  4096x 11008  rocBLAS  112.12   triton_v3   93.33 (  83%)   triton_v4   94.40 (  84%)
decode        1x  4096x  4096  rocBLAS    0.69   triton_v3    0.44 (  64%)   triton_v4    0.46 (  67%)
decode        4x  4096x  4096  rocBLAS    2.72   triton_v3    1.74 (  64%)   triton_v4    1.82 (  67%)
decode       16x  4096x  4096  rocBLAS   10.69   triton_v3    6.95 (  65%)   triton_v4    7.23 (  68%)
decode        1x 11008x  4096  rocBLAS    1.13   triton_v3    0.90 (  80%)   triton_v4    0.97 (  86%)
esm        1024x  3840x  1280  rocBLAS   76.35   triton_v3   68.31 (  89%)   triton_v4   69.29 (  91%)
esm        1024x  1280x  1280  rocBLAS   61.14   triton_v3   58.91 (  96%)   triton_v4   55.19 (  90%)
esm        1024x  5120x  1280  rocBLAS   83.47   triton_v3   80.35 (  96%)   triton_v4   84.56 ( 101%)
esm        1024x  1280x  5120  rocBLAS   88.02   triton_v3   74.63 (  85%)   triton_v4   66.00 (  75%)
odd        1000x  1000x  1000  rocBLAS   39.18   triton_v3   26.54 (  68%)   triton_v4   27.23 (  69%)
odd        3000x  2000x  1500  rocBLAS   76.50   triton_v3   65.37 (  85%)   triton_v4   68.06 (  89%)